{
  "eventId": "evt-payment-001",
  "eventType": "payment.completed",
  "version": 1,
  "aggregateId": "PAY-001",
  "aggregateVersion": 3,
  "occurredAt": "2026-10-01T08:00:00Z",
  "correlationId": "req-payment-001",
  "payload": {
    "paymentId": "PAY-001",
    "tripId": "TRIP-001",
    "customerId": "CUS-001",
    "amount": 50000,
    "currency": "VND"
  }
}
